{
  "id": "demo-unknown-withdrawal",
  "mode": "generate",
  "route": "product",
  "content_type": "withdrawal-status",
  "goal": "بیان نبود نتیجه قطعی",
  "audience": "کاربر منتظر نتیجه برداشت",
  "knowledge_level": "unknown",
  "financial_sensitivity": "high",
  "facts": [
    {
      "statement": "در این مثال آموزشی نتیجه برداشت هنوز قطعی نیست",
      "source_ref": "synthetic-demo",
      "verified_at": "2026-10-13",
      "scope": "فقط سناریوی آموزشی"
    }
  ],
  "unknowns": [
    "وضعیت کسر مبلغ",
    "امکان تکرار درخواست",
    "زمان نتیجه نهایی"
  ],
  "output_format": "text"
}
